{
  "$schema": "http://json-schema.org/draft-07/schema#",

  "definitions": {
    "exposure": {
      "type": "string",
      "enum": [
        "ServiceWorker",
        "SharedWorker",
        "Window",
        "Worker",
        "WebAssembly"
      ]
    },

    "feature_name": {
      "type": "string",
      "pattern": "^[a-zA-Z_0-9-$@.]*$",
      "description": "Dot separated identifier path.\n\n@example \"javascript.builtins.Array.at\""
    },

    "result_message": {
      "type": "string",
      "description": "An error message from the browser or from the test framework.\n\n@example \"threw TypeError: Failed to construct 'Notification': Illegal constructor.\"\n@example \"Testing CanvasRenderingContext2D in workers is not yet implemented\"\n@example \"Browser does not support detection methods\""
    },

    "collector_result": {
      "oneOf": [
        {
          "type": "object",
          "properties": {
            "exposure": {"$ref": "#/definitions/exposure"},
            "message": {"$ref": "#/definitions/result_message"},
            "name": {"$ref": "#/definitions/feature_name"},
            "result": {"type": "boolean"}
          },
          "additionalProperties": false,
          "required": ["exposure", "name", "result"]
        },
        {
          "type": "object",
          "properties": {
            "exposure": {"$ref": "#/definitions/exposure"},
            "message": {"$ref": "#/definitions/result_message"},
            "name": {"$ref": "#/definitions/feature_name"},
            "result": {"type": "null"}
          },
          "additionalProperties": false,
          "required": ["exposure", "message", "name", "result"]
        }
      ]
    },

    "flag_statement": {
      "type": "object",
      "properties": {
        "type": {
          "type": "string",
          "description": "Flag type.",
          "enum": ["preference", "runtime_flag"]
        },
        "name": {
          "type": "string",
          "description": "Name of the flag or preference to configure."
        },
        "value_to_set": {
          "type": "string",
          "description": "Value to set the flag to."
        }
      },
      "additionalProperties": false,
      "required": ["type", "name"]
    }
  },

  "title": "Report",
  "type": "object",
  "properties": {
    "__version": {
      "type": "string",
      "pattern": "^[0-9.]+$",
      "description": "Version of mdn-bcd-collector that collected the report."
    },
    "extensions": {
      "type": "array",
      "items": {
        "type": "string"
      }
    },
    "results": {
      "type": "object",
      "patternProperties": {
        "^.*$": {
          "type": "array",
          "items": {
            "$ref": "#/definitions/collector_result"
          }
        }
      },
      "minProperties": 1
    },
    "userAgent": {
      "type": "string",
      "description": "User agent of tested browser."
    },
    "preview": {
      "type": "boolean",
      "description": "Whether the report is from a preview browser (Nightly, Canary, Technical Preview)."
    },
    "flags": {
      "type": "array",
      "description": "Feature flags that must be configured for this browser to support this feature.",
      "items": {
        "$ref": "#/definitions/flag_statement"
      }
    }
  },
  "required": ["__version", "results", "userAgent"],
  "additionalProperties": false
}
